[
  {
    "id": "U-001",
    "status": "IN_REVIEW",
    "spec": "Placeholder spec for unit U-001",
    "dependencies": [],
    "tests_required": true
  },
  {
    "id": "U-002",
    "status": "IN_REVIEW",
    "spec": "Placeholder spec for unit U-002",
    "dependencies": [],
    "tests_required": true
  },
  {
    "id": "U-003",
    "status": "IN_PROGRESS",
    "spec": "Placeholder spec for unit U-003",
    "dependencies": [],
    "tests_required": true
  },
  {
    "id": "U-004",
    "status": "IN_REVIEW",
    "spec": "Placeholder spec for unit U-004",
    "dependencies": [],
    "tests_required": true
  },
  {
    "id": "U-005",
    "status": "IN_REVIEW",
    "spec": "Placeholder spec for unit U-005",
    "dependencies": [],
    "tests_required": true
  },
  {
    "id": "U-006",
    "status": "IN_REVIEW",
    "spec": "Placeholder spec for unit U-006",
    "dependencies": [],
    "tests_required": true
  },
  {
    "id": "U-007",
    "status": "IN_REVIEW",
    "spec": "Placeholder spec for unit U-007",
    "dependencies": [],
    "tests_required": true
  },
  {
    "id": "U-008",
    "status": "IN_REVIEW",
    "spec": "Placeholder spec for unit U-008",
    "dependencies": [],
    "tests_required": true
  },
  {
    "id": "U-009",
    "status": "IN_REVIEW",
    "spec": "Placeholder spec for unit U-009",
    "dependencies": [],
    "tests_required": true
  },
  {
    "id": "U-010",
    "status": "IN_REVIEW",
    "spec": "Placeholder spec for unit U-010",
    "dependencies": [],
    "tests_required": true
  },
  {
    "id": "U-011",
    "status": "IN_REVIEW",
    "spec": "Placeholder spec for unit U-011",
    "dependencies": [],
    "tests_required": true
  },
  {
    "id": "U-012",
    "status": "IN_REVIEW",
    "spec": "Placeholder spec for unit U-012",
    "dependencies": [],
    "tests_required": true
  },
  {
    "id": "U-013",
    "status": "IN_REVIEW",
    "spec": "Placeholder spec for unit U-013",
    "dependencies": [],
    "tests_required": true
  },
  {
    "id": "U-014",
    "status": "IN_REVIEW",
    "spec": "Placeholder spec for unit U-014",
    "dependencies": [],
    "tests_required": true
  },
  {
    "id": "U-015",
    "status": "IN_REVIEW",
    "spec": "Placeholder spec for unit U-015",
    "dependencies": [],
    "tests_required": true
  },
  {
    "id": "U-016",
    "status": "IN_PROGRESS",
    "spec": "Placeholder spec for unit U-016",
    "dependencies": [],
    "tests_required": true
  },
  {
    "id": "U-017",
    "status": "IN_REVIEW",
    "spec": "Placeholder spec for unit U-017",
    "dependencies": [],
    "tests_required": true
  },
  {
    "id": "U-018",
    "status": "IN_REVIEW",
    "spec": "Placeholder spec for unit U-018",
    "dependencies": [],
    "tests_required": true
  },
  {
    "id": "U-019",
    "status": "IN_REVIEW",
    "spec": "Placeholder spec for unit U-019",
    "dependencies": [],
    "tests_required": true
  },
  {
    "id": "U-020",
    "status": "IN_REVIEW",
    "spec": "Placeholder spec for unit U-020",
    "dependencies": [],
    "tests_required": true
  },
  {
    "id": "U-021",
    "status": "IN_REVIEW",
    "spec": "Placeholder spec for unit U-021",
    "dependencies": [],
    "tests_required": true
  },
  {
    "id": "U-022",
    "status": "IN_REVIEW",
    "spec": "Placeholder spec for unit U-022",
    "dependencies": [],
    "tests_required": true
  },
  {
    "id": "U-023",
    "status": "IN_REVIEW",
    "spec": "Placeholder spec for unit U-023",
    "dependencies": [],
    "tests_required": true
  },
  {
    "id": "U-024",
    "status": "IN_REVIEW",
    "spec": "Placeholder spec for unit U-024",
    "dependencies": [],
    "tests_required": true
  },
  {
    "id": "U-025",
    "status": "IN_REVIEW",
    "spec": "Placeholder spec for unit U-025",
    "dependencies": [],
    "tests_required": true
  },
  {
    "id": "U-026",
    "status": "IN_REVIEW",
    "spec": "Placeholder spec for unit U-026",
    "dependencies": [],
    "tests_required": true
  },
  {
    "id": "U-027",
    "status": "IN_REVIEW",
    "spec": "Placeholder spec for unit U-027",
    "dependencies": [],
    "tests_required": true
  },
  {
    "id": "U-028",
    "status": "IN_REVIEW",
    "spec": "Placeholder spec for unit U-028",
    "dependencies": [],
    "tests_required": true
  },
  {
    "id": "U-029",
    "status": "IN_REVIEW",
    "spec": "Placeholder spec for unit U-029",
    "dependencies": [],
    "tests_required": true
  },
  {
    "id": "U-030",
    "status": "IN_REVIEW",
    "spec": "Placeholder spec for unit U-030",
    "dependencies": [],
    "tests_required": true
  },
  {
    "id": "U-031",
    "status": "DONE",
    "spec": "Placeholder spec for unit U-031",
    "dependencies": [],
    "tests_required": true
  },
  {
    "id": "U-032",
    "status": "IN_REVIEW",
    "spec": "Placeholder spec for unit U-032",
    "dependencies": [],
    "tests_required": true
  },
  {
    "id": "U-033",
    "status": "IN_REVIEW",
    "spec": "Placeholder spec for unit U-033",
    "dependencies": [],
    "tests_required": true
  },
  {
    "id": "U-034",
    "status": "PENDING",
    "spec": "Code quality gates:\n- Place a CI pipeline step that runs: npm test, npm run lint, npm run build when package.json exists in that repo path.\n- Implementation: Add a GitHub Actions workflow .github/workflows/code-quality.yml that detects JS/TS packages under netnet/cockpit and runs the commands.\n- Acceptance: workflow runs on PR and passes; workflow artifacts show test output. Done when workflow file exists and a sample PR triggers success.",
    "dependencies": [],
    "tests_required": true
  },
  {
    "id": "U-035",
    "status": "PENDING",
    "spec": "UI/UX design system pass:\n- Implement a design tokens file at netnet/cockpit/src/styles/design-tokens.ts with spacing, typography, colors, and status badge components at netnet/cockpit/src/components/Badge.tsx.\n- Acceptance: All cockpit pages import design-tokens; manual QA checklist (consistency, spacing, typography) saved to docs/ui/checklist.md. Done when component library exports Badge and token file referenced by at least 2 pages.",
    "dependencies": [],
    "tests_required": true
  },
  {
    "id": "U-036",
    "status": "PENDING",
    "spec": "Work templates library:\n- Add templates under netnet/cockpit/src/templates/*.json for deploy, revenue-idea, content-pack, lead-pack, automation-sprint.\n- Each template includes fields, example payload, and a render helper netnet/cockpit/src/templates/index.ts exporting listTemplates().\n- Acceptance: templates can be fetched via API client lib/apiClient.ts and validated by unit tests under tests/templates_test.py. Done when templates present and tests pass.",
    "dependencies": [],
    "tests_required": true
  },
  {
    "id": "U-037",
    "status": "PENDING",
    "spec": "Revenue program: Content Pack:\n- Implement pipeline under netnet/cockpit/src/revenue/content_pack.ts that accepts inputs and emits artifact bundle stored to netnet/storage/content/<id>.zip (or IPFS hash placeholder).\n- Acceptance: function createContentPack(inputs) returns metadata including storage path and hash; unit test validates sample inputs produce artifact and metadata. Done when endpoint and tests are added.",
    "dependencies": [],
    "tests_required": true
  },
  {
    "id": "U-038",
    "status": "PENDING",
    "spec": "Revenue program: Lead Pack:\n- Implement netnet/cockpit/src/revenue/lead_pack.ts which ingests leads data and produces CSV plus outreach copy and tracking fields.\n- Acceptance: createLeadPack(inputs) returns {csvPath, outreachCopy, tracking}. Unit test verifies CSV schema and content. Done when file and tests are added.",
    "dependencies": [],
    "tests_required": true
  },
  {
    "id": "U-039",
    "status": "PENDING",
    "spec": "Net Benefit Receipt enforcement:\n- Add schema and validator at netnet/cockpit/src/receipts/receipt.ts that enforces: ValueDelivered, ReceiptStatus (DONE|PENDING), NextRunRecommendation.\n- Acceptance: validator rejects incomplete bundles; runner attaches receipt to job metadata. Unit tests under tests/receipts_test.py. Done when validator and tests exist.",
    "dependencies": [],
    "tests_required": true
  },
  {
    "id": "U-040",
    "status": "PENDING",
    "spec": "Deploy Netnet stable URL:\n- Provide deployment documentation and scripts: docker-compose.yml addition in netnet/deploy/, systemd unit example netnet/deploy/netnet.service, nginx config netnet/deploy/nginx.conf.\n- Acceptance: docs/deploy.md describes steps and scripts present. Done when files exist and docs validated.",
    "dependencies": [],
    "tests_required": true
  },
  {
    "id": "U-041",
    "status": "PENDING",
    "spec": "Auth / operator key:\n- Implement simple operator auth middleware in netnet/cockpit/src/server/auth.ts reading header X-Operator-Key matched against env OPERATOR_KEY.\n- Acceptance: protected endpoints return 401 without header. Tests under tests/auth_test.py. Done when middleware and tests exist.",
    "dependencies": [],
    "tests_required": true
  },
  {
    "id": "U-042",
    "status": "PENDING",
    "spec": "Autonomy modes:\n- Add UI control at netnet/cockpit/src/components/AutonomyMode.tsx with modes OFF/PROPOSE/EXECUTE and policy envelope editor.\n- Backend policy stored at netnet/cockpit/src/policy/modes.json and enforced by worker (config flag).\n- Acceptance: switch changes behavior in UI and worker reads policy. Tests: integration test toggles mode and verifies worker respects caps.",
    "dependencies": [],
    "tests_required": true
  },
  {
    "id": "U-043",
    "status": "PENDING",
    "spec": "Execution Adapter Layer:\n- Implement adapter interface netnet/cockpit/src/adapter/adapter.ts with methods runJob(job,opts) and local + conway adapters implementing it at adapter/local.ts and adapter/conway.ts.\n- Acceptance: worker routes execution via adapter.runJob. Unit tests mock adapters. Done when adapters and tests added.",